{
  "$schema": "http://json-schema.org/draft-07/schema#",
  "title": "CaveStack Voice Profile",
  "description": "Defines how generateVoiceDirective() emits voice instructions for skills",
  "type": "object",
  "required": ["name", "directive"],
  "properties": {
    "name": {
      "type": "string",
      "description": "Profile identifier (e.g., caveman-full, none)",
      "pattern": "^[a-z0-9-]+$"
    },
    "description": {
      "type": "string",
      "description": "Human-readable description of this voice profile"
    },
    "directive": {
      "type": "object",
      "description": "Voice directive content by preamble tier",
      "required": ["compact", "full"],
      "properties": {
        "compact": {
          "type": "string",
          "description": "Compact voice directive for tier 1 (browse, benchmark, setup)"
        },
        "full": {
          "type": "string",
          "description": "Full voice directive for tiers 2-4 (most skills)"
        }
      }
    },
    "priority_instruction": {
      "type": "string",
      "description": "Runtime injection line for caveman-voice-priority.js hook"
    },
    "verbose_phrases": {
      "type": "array",
      "description": "Verbose-to-cave substitution pairs for voice-audit --fix mode",
      "items": {
        "type": "array",
        "items": { "type": "string" },
        "minItems": 2,
        "maxItems": 2
      }
    },
    "density_thresholds": {
      "type": "object",
      "description": "Density thresholds for voice-audit checks",
      "properties": {
        "articlesPerHundred": { "type": "number" },
        "fillersPerHundred": { "type": "number" },
        "hedgesPerHundred": { "type": "number" },
        "verbosePhraseMax": { "type": "number" }
      }
    },
    "content_floors": {
      "type": "object",
      "description": "Substance-level floors that flag claims requiring hedging or sourcing. Separate from density_thresholds (which count cosmetic tokens).",
      "properties": {
        "unverified_internet_claim": {
          "type": "object",
          "description": "Flag prose that cites internet/web/WebSearch as authoritative without a hypothesis hedge.",
          "properties": {
            "enabled": { "type": "boolean" },
            "trigger_patterns": {
              "type": "array",
              "description": "Regex patterns that indicate an internet-sourced claim is being asserted.",
              "items": { "type": "string" }
            },
            "required_hedges": {
              "type": "array",
              "description": "At least one of these hedge tokens must appear near the trigger to pass.",
              "items": { "type": "string" }
            },
            "max_violations": {
              "type": "number",
              "description": "Number of unhedged internet claims allowed per document."
            }
          },
          "required": ["enabled"]
        }
      }
    }
  },
  "additionalProperties": false
}
